{
  "schemaVersion": "2.0.0",
  "profile": "block-garden-reference-v1",
  "sourceVideoSha256": "7aec0cb6336742247c9f4648e80f0cffd4e373d0eb835bb22848a797f2ed7cba",
  "analysisBasis": {
    "framesProcessed": 13546,
    "frameCoveragePercent": 100,
    "manualReviewPasses": [
      "whole-video contact sheet at 2s cadence",
      "80 salience peaks",
      "dense first-clear",
      "dense new-high-score",
      "dense endgame"
    ],
    "note": "The catalog describes semantic atoms and renderer representations; it is not a bitmap file list."
  },
  "vocabularies": {
    "kind": [
      "visual-asset",
      "vector",
      "typography",
      "render-recipe",
      "motion-recipe",
      "particle-recipe",
      "rule-binding",
      "color-token",
      "geometry-asset",
      "audio-asset"
    ],
    "engineRequirement": [
      "core-required",
      "optional"
    ],
    "triggerRequirement": [
      "required",
      "optional",
      "not-applicable"
    ],
    "referenceRequirement": [
      "required",
      "optional",
      "capture-only"
    ],
    "spatialRepresentation": [
      "screen-2d",
      "vector",
      "bitmap",
      "procedural-2d",
      "procedural-screen-vfx",
      "camera-facing-2d",
      "layered-2.5d-sprite",
      "normal-mapped-sprite",
      "camera-profile-dependent-layout",
      "shallow-3d",
      "full-3d",
      "baked-view-sprite",
      "baked-transform-3d",
      "motion-recipe",
      "nonvisual-rule",
      "not-applicable",
      "optional-full-3d"
    ],
    "status": [
      "observed",
      "inferred",
      "unresolved"
    ],
    "replaceability": [
      "independent",
      "rule-preserving",
      "rule-bound",
      "director-controlled"
    ],
    "viewDependency": [
      "none",
      "camera-profile-dependent",
      "lighting-profile-dependent",
      "fully-baked"
    ],
    "implementationStatus": [
      "implemented",
      "partial",
      "not-implemented",
      "prototype-only"
    ]
  },
  "observedPalette": {
    "colorCount": 7,
    "tokens": [
      "coral",
      "amber",
      "lime",
      "cyan",
      "blue",
      "violet",
      "rose"
    ],
    "evidence": "Full-video stable-cell clustering plus manual review of static frames."
  },
  "groupConstraints": [
    {
      "id": "placement-confirmation",
      "policy": "at-least-one",
      "members": [
        "placement.tile-pop",
        "placement.cell-glow",
        "placement.thumb-badge"
      ]
    },
    {
      "id": "clear-primary-cue",
      "policy": "at-least-one",
      "members": [
        "clear.sweep.horizontal.body",
        "clear.sweep.vertical.body",
        "clear.tile-dissolve"
      ]
    },
    {
      "id": "clear-destruction-consistency",
      "policy": "all-required-when-clear",
      "members": [
        "clear.tile-destruction",
        "clear.tile-dissolve"
      ]
    },
    {
      "id": "reference-praise-family",
      "policy": "asset-required-when-tier-triggered",
      "members": [
        "praise.nice.art",
        "praise.great.art",
        "praise.amazing.art",
        "praise.incredible.art",
        "praise.fantastic.art",
        "praise.unbelievable.art"
      ]
    }
  ],
  "atoms": [
    {
      "id": "capture.debug-version-label",
      "label": "顶部调试版本标识",
      "category": "capture",
      "kind": "typography",
      "status": "observed",
      "requirement": {
        "engine": "optional",
        "whenTriggered": "not-applicable",
        "referenceProfile": "capture-only"
      },
      "trigger": "capture-build-metadata",
      "allowsNone": true,
      "replaceability": "independent",
      "spatialRepresentations": {
        "reference2d": "screen-2d",
        "fixedCameraCinematic": "screen-2d",
        "full3dSandbox": "screen-2d"
      },
      "viewDependency": {
        "reference2d": "none",
        "fixedCameraCinematic": "none"
      },
      "evidenceSelectors": [
        "full-video-contact-scan"
      ],
      "dependencies": [],
      "implementationStatus": "not-implemented",
      "notes": "视频顶部中央存在极低对比度版本字符串；不属于正式玩法画面。"
    },
    {
      "id": "capture.debug-session-label",
      "label": "底部测试/会话标识",
      "category": "capture",
      "kind": "typography",
      "status": "observed",
      "requirement": {
        "engine": "optional",
        "whenTriggered": "not-applicable",
        "referenceProfile": "capture-only"
      },
      "trigger": "capture-session-metadata",
      "allowsNone": true,
      "replaceability": "independent",
      "spatialRepresentations": {
        "reference2d": "screen-2d",
        "fixedCameraCinematic": "screen-2d",
        "full3dSandbox": "screen-2d"
      },
      "viewDependency": {
        "reference2d": "none",
        "fixedCameraCinematic": "none"
      },
      "evidenceSelectors": [
        "full-video-contact-scan"
      ],
      "dependencies": [],
      "implementationStatus": "not-implemented",
      "notes": "视频底部存在极低对比度 test/session 字符串；正式导出默认关闭。"
    },
    {
      "id": "scene.canvas-profile",
      "label": "设计画布与安全区",
      "category": "scene",
      "kind": "render-recipe",
      "status": "observed",
      "requirement": {
        "engine": "core-required",
        "whenTriggered": "not-applicable",
        "referenceProfile": "required"
      },
      "trigger": "project-load",
      "allowsNone": false,
      "replaceability": "rule-preserving",
      "spatialRepresentations": {
        "reference2d": "screen-2d",
        "fixedCameraCinematic": "screen-2d",
        "full3dSandbox": "screen-2d"
      },
      "viewDependency": {
        "reference2d": "none",
        "fixedCameraCinematic": "none"
      },
      "evidenceSelectors": [
        "frame-range:0-13545"
      ],
      "dependencies": [],
      "implementationStatus": "implemented"
    },
    {
      "id": "background.base-gradient",
      "label": "主绿色渐变背景",
      "category": "background",
      "kind": "render-recipe",
      "status": "observed",
      "requirement": {
        "engine": "core-required",
        "whenTriggered": "not-applicable",
        "referenceProfile": "required"
      },
      "trigger": "scene-visible",
      "allowsNone": false,
      "replaceability": "independent",
      "spatialRepresentations": {
        "reference2d": "procedural-2d",
        "fixedCameraCinematic": "screen-2d",
        "full3dSandbox": "screen-2d"
      },
      "viewDependency": {
        "reference2d": "none",
        "fixedCameraCinematic": "none"
      },
      "evidenceSelectors": [
        "frame-range:0-13545"
      ],
      "dependencies": [],
      "implementationStatus": "implemented"
    },
    {
      "id": "background.surface-texture",
      "label": "背景细微纹理/压缩层次",
      "category": "background",
      "kind": "visual-asset",
      "status": "observed",
      "requirement": {
        "engine": "optional",
        "whenTriggered": "not-applicable",
        "referenceProfile": "required"
      },
      "trigger": "scene-visible",
      "allowsNone": true,
      "replaceability": "independent",
      "spatialRepresentations": {
        "reference2d": "bitmap",
        "fixedCameraCinematic": "layered-2.5d-sprite",
        "full3dSandbox": "baked-view-sprite"
      },
      "viewDependency": {
        "reference2d": "none",
        "fixedCameraCinematic": "camera-profile-dependent"
      },
      "evidenceSelectors": [
        "full-video-contact-scan"
      ],
      "dependencies": [],
      "implementationStatus": "not-implemented"
    },
    {
      "id": "background.central-halo",
      "label": "棋盘后方柔光晕",
      "category": "background",
      "kind": "render-recipe",
      "status": "observed",
      "requirement": {
        "engine": "optional",
        "whenTriggered": "not-applicable",
        "referenceProfile": "required"
      },
      "trigger": "scene-visible",
      "allowsNone": true,
      "replaceability": "independent",
      "spatialRepresentations": {
        "reference2d": "procedural-2d",
        "fixedCameraCinematic": "procedural-screen-vfx",
        "full3dSandbox": "procedural-screen-vfx"
      },
      "viewDependency": {
        "reference2d": "none",
        "fixedCameraCinematic": "camera-profile-dependent"
      },
      "evidenceSelectors": [
        "frame-range:0-13545"
      ],
      "dependencies": [],
      "implementationStatus": "implemented"
    },
    {
      "id": "background.micro-specks",
      "label": "背景微型亮点和彩屑",
      "category": "background",
      "kind": "particle-recipe",
      "status": "observed",
      "requirement": {
        "engine": "optional",
        "whenTriggered": "not-applicable",
        "referenceProfile": "required"
      },
      "trigger": "ambient-loop",
      "allowsNone": true,
      "replaceability": "independent",
      "spatialRepresentations": {
        "reference2d": "procedural-2d",
        "fixedCameraCinematic": "camera-facing-2d",
        "full3dSandbox": "camera-facing-2d"
      },
      "viewDependency": {
        "reference2d": "none",
        "fixedCameraCinematic": "camera-profile-dependent"
      },
      "evidenceSelectors": [
        "full-video-contact-scan"
      ],
      "dependencies": [],
      "implementationStatus": "partial"
    },
    {
      "id": "background.flower-outline",
      "label": "候选区附近淡花轮廓",
      "category": "background",
      "kind": "vector",
      "status": "observed",
      "requirement": {
        "engine": "optional",
        "whenTriggered": "not-applicable",
        "referenceProfile": "required"
      },
      "trigger": "ambient-or-tray-transition",
      "allowsNone": true,
      "replaceability": "independent",
      "spatialRepresentations": {
        "reference2d": "vector",
        "fixedCameraCinematic": "camera-facing-2d",
        "full3dSandbox": "camera-facing-2d"
      },
      "viewDependency": {
        "reference2d": "none",
        "fixedCameraCinematic": "camera-profile-dependent"
      },
      "evidenceSelectors": [